{
  "schema_version": 1,
  "run_id": "run_018f6b6e-8a2e-7c3a-8b2a-6d1e2f3a4b5c",
  "state": "succeeded",
  "snapshot": {
    "revision": 7,
    "content": [{"type": "text", "text": "incident summarized"}],
    "digest": "sha256:cccccccccccccccccccccccccccccccccccccccccccccccccccccccccccccccc"
  },
  "usage": {"input_tokens": 22, "output_tokens": 4, "duration_ms": 840},
  "completed_at": "2026-09-27T09:00:04Z"
}
